{
  "schema_version": "1.0",
  "pack_id": "learning-pack-v1-sample-geo-001",
  "source_report": {
    "report_id": "field-note-2026-03-19",
    "title": "Portal mapping shift notes"
  },
  "items": [
    {
      "id": "learn-word-weathered",
      "type": "word",
      "content": "weathered",
      "meaning": "rock/soil altered by exposure and breakdown",
      "example": "Weathered volcanics observed near the brow.",
      "tags": ["mapping", "material"]
    },
    {
      "id": "learn-phrase-open-joint",
      "type": "phrase",
      "content": "open joint",
      "meaning": "joint aperture is visibly open",
      "example": "Open joint with seepage noted along left wall.",
      "note": "Use with aperture estimate where possible",
      "tags": ["feature", "inspection"]
    },
    {
      "id": "learn-sentence-ravelling",
      "type": "sentence",
      "content": "Localized ravelling observed beneath the overbreak edge.",
      "note": "Reusable observation sentence for shift reports",
      "tags": ["reporting"]
    },
    {
      "id": "learn-concept-detached-block-risk",
      "type": "concept",
      "content": "Detached blocks can indicate progressive instability when crack width is increasing.",
      "meaning": "watch trend over repeated inspections",
      "tags": ["risk", "trend"]
    }
  ]
}
