{
  "schema_version": "1.0",
  "pack_id": "learning-export-seed-helper-geo-001",
  "source_report": {
    "report_id": "shift-portal-2026-03-20",
    "title": "Portal shift learning export"
  },
  "items": [
    {
      "id": "seed-word-weathered",
      "type": "word",
      "content": "weathered",
      "meaning": "rock mass altered by exposure",
      "tags": ["material"]
    },
    {
      "id": "seed-phrase-open-joint",
      "type": "phrase",
      "content": "open joint",
      "meaning": "joint aperture is visibly open",
      "example": "Open joint observed along the left wall.",
      "domain": "slope",
      "tags": ["feature", "inspection"],
      "source_report": "portal-shift-01"
    },
    {
      "id": "seed-sentence-ravelling",
      "type": "sentence",
      "content": "Localized ravelling observed beneath the overbreak edge.",
      "note": "Reusable wording for field reporting.",
      "domain": "reporting",
      "tags": ["reporting", "feature"]
    },
    {
      "id": "seed-concept-detached-block",
      "type": "concept",
      "content": "Detached blocks can indicate progressive instability when crack width is increasing.",
      "meaning": "trend the crack width over repeated inspections",
      "domain": "safety",
      "tags": ["risk", "trend"]
    },
    {
      "id": "seed-concept-hand-scaling",
      "type": "concept",
      "content": "Hand scaling should be completed before the next inspection cycle when loose rock is exposed.",
      "note": "Treat as an immediate hazard-reduction action.",
      "domain": "support",
      "tags": ["action", "support"]
    },
    {
      "id": "seed-phrase-fault-gouge",
      "type": "phrase",
      "content": "fault gouge",
      "meaning": "clay-rich sheared infill along a fault plane",
      "example": "Fault gouge exposed in the sidewall seam.",
      "domain": "geology",
      "tags": ["material", "mapping"]
    }
  ]
}
